{
  "$schema": "https://json-schema.org/draft/2020-12/schema",
  "$id": "https://quirkbench.invalid/schemas/target-endpoint-intent.v1.schema.json",
  "type": "object",
  "additionalProperties": false,
  "required": [
    "schema_version",
    "record_type",
    "request_id",
    "device_id",
    "media_instance_id",
    "target_binding",
    "runtime_sha256",
    "boot_config_sha256",
    "controller_url",
    "remote_urls",
    "approved_certificate_sha256"
  ],
  "properties": {
    "schema_version": {
      "type": "integer",
      "const": 1
    },
    "record_type": {
      "const": "target-endpoint-intent"
    },
    "request_id": {
      "type": "string",
      "pattern": "^[A-Za-z0-9][A-Za-z0-9_.-]{0,127}$"
    },
    "device_id": {
      "type": "string",
      "pattern": "^[A-Za-z0-9][A-Za-z0-9_.-]{0,127}$"
    },
    "media_instance_id": {
      "type": "string",
      "pattern": "^[A-Za-z0-9][A-Za-z0-9_.-]{0,127}$"
    },
    "target_binding": {
      "type": "object",
      "additionalProperties": false,
      "required": [
        "schema_version",
        "system_uuid"
      ],
      "properties": {
        "schema_version": {
          "type": "integer",
          "const": 1
        },
        "system_uuid": {
          "type": "string",
          "format": "uuid"
        }
      }
    },
    "runtime_sha256": {
      "type": "string",
      "pattern": "^[0-9a-f]{64}$"
    },
    "boot_config_sha256": {
      "type": "string",
      "pattern": "^[0-9a-f]{64}$"
    },
    "controller_url": {
      "type": "string",
      "maxLength": 4096
    },
    "remote_urls": {
      "type": "object",
      "minProperties": 1,
      "maxProperties": 8,
      "additionalProperties": {
        "type": "string",
        "maxLength": 4096
      }
    },
    "approved_certificate_sha256": {
      "type": "string",
      "pattern": "^[0-9a-f]{64}$"
    }
  }
}
