{
  "schema_version": 1,
  "record_type": "target-endpoint-intent",
  "request_id": "endpoint-move-1",
  "device_id": "target-a",
  "media_instance_id": "media-a",
  "target_binding": {
    "schema_version": 1,
    "system_uuid": "12345678-1234-1234-1234-123456789abc"
  },
  "runtime_sha256": "0000000000000000000000000000000000000000000000000000000000000000",
  "boot_config_sha256": "0000000000000000000000000000000000000000000000000000000000000000",
  "controller_url": "https://192.0.2.11:8443",
  "remote_urls": {
    "lab": "https://192.0.2.11:8444/lab"
  },
  "approved_certificate_sha256": "0000000000000000000000000000000000000000000000000000000000000000"
}
